TSLA,Tesla Inc ,2019-03-05,Top Tesla shareholder says Musk 'doesn't need to be CEO': Barron's ,Tesla Inc's largest shareholder expressed its support for Chief Executive Officer Elon Musk  but acknowledged that it was open to a different role for the electric carmaker's founder and CEO  Barron's reported on Tuesday.,topStory
TSLA,Tesla Inc ,2019-03-05,Top Tesla shareholder says Musk "doesn't need to be CEO"- Barron's ,March 5 Tesla Inc's largest shareholder expressed its support for Chief Executive Officer Elon Musk  but acknowledged that it was open to a different role for the electric carmaker's founder and CEO  Barron's reported on Tuesday.,normal
TSLA,Tesla Inc ,2019-03-05,Tesla blames misprinted label for China customs hiccup ,BENGALURU/SHANGHAI Tesla Inc said on Tuesday that China's customs authorities have accepted the electric carmaker's plan to resolve problems with the clearance of its Model 3 sedans that centered around misprinting of labels.,normal
TSLA,Tesla Inc ,2019-03-05,UPDATE 4-Tesla blames misprinted label for China customs hiccup ,* Ports to step up inspections of other Tesla vehicles (Adds Tesla's response; updates shares),normal
TSLA,Tesla Inc ,2019-03-05,China agrees on solution to Tesla customs issue: source ,China's customs authorities have accepted electric carmaker Tesla Inc's plan to remedy problems with the clearance of imported cars  a source familiar with the matter told Reuters.,normal
TSLA,Tesla Inc ,2019-03-05,REFILE-China agrees on solution to Tesla customs issue -source ,March 5 China's customs authorities have accepted electric carmaker Tesla Inc's plan to remedy problems with the clearance of imported cars  a source familiar with the matter told Reuters.,normal
TSLA,Tesla Inc ,2019-03-05,China suspends customs clearance for Tesla Model 3 imports - Caixin ,BEIJING/SHANGHAI  March 5 China's customs authority has suspended customs clearance procedures for Model 3 cars built by Tesla Inc  the financial publication Caixin reported on Tuesday.,normal
